{
  "setId": "mob_set_34599d14fb234ff2837ad7dc453ec21a",
  "sessionId": "mob_session_7b7c6d325d234be7b6cba379ad12c659",
  "exerciseSessionId": "exercise_session_17b70728c8a54338b28a45b40c83092c",
  "setNumber": 1,
  "weight": 100,
  "reps": 8,
  "rir": 2,
  "setType": "WORKING",
  "comment": null,
  "startedAt": 1784102520000,
  "completedAt": 1784102580000,
  "source": "WATCH",
  "heartRateSummary": {
    "min": 112,
    "max": 158,
    "average": 141.4,
    "start": 118,
    "end": 154,
    "sampleCount": 25
  },
  "sensorSummary": {},
  "revision": 8
}
